occurred_at_iso,type,severity,title,description,lat,lng,source_name,source_url
2026-07-13T06:27:01.000Z,ship_incident,medium,Greek tanker exits Gulf as Strait of Hormuz transits crash to five-week low,Greek tanker exits Gulf as Strait of Hormuz transits crash to five-week low TradeWinds News,,,TradeWinds News,https://news.google.com/rss/articles/CBMixAFBVV95cUxOTE10SXczb0pmOENhU2ItUTNIcV9LcFhKbUhSUmZQUi1FR3BVLUExSWdrTFZHRGJXNHdJY3ppX0drQ1lGT3V1em1Zc3JqWm10YVpoRV9jVF9MZl9Wd3ZUeHMwYnJORDFQb2NabHU3TTRsMWVva1l4TXpXZHBja3JtbXotdWRNSnIzZVFrbWtiQkhHR2ZBdWV1ZVA1NjZEVkk2Tkg2emhhaXd0NVZiZDl2bmJsR1czNTI5M1N4TGd3b2ZzMjFi?oc=5
2026-07-13T06:32:25.000Z,closure,high,Oil prices surge 5% after Iran declares Strait of Hormuz closed,Oil prices surge 5% after Iran declares Strait of Hormuz closed Investing.com,,,Investing.com,https://news.google.com/rss/articles/CBMivwFBVV95cUxNS2N5THZ6TUY2R0R6dGFCeVV3Y2FUMUpNalVwWXBISGh3R24tSV9SYkE4c2ZrbDhVVUtKMi15OF9sVkVxbk0zS0dLNkFzNW9QdDJkZnVjREU4X28xT2xyVG5peUZmZE9FWFp4a0ZUd2gwYkNFTHh5T2EzNkhTWnFSdkl0UTlRN01MWFdiTC1Zc0Y5Y01PSmFFNDFObUhMNno2dEtEN0VNWWxPRFBaUThubnRYaUlIZllDeXd2N0Ffdw?oc=5
2026-07-13T06:35:00.000Z,strike,high,Iran strikes U.S. bases across Gulf as fight over Hormuz escalates,Iran strikes U.S. bases across Gulf as fight over Hormuz escalates Haaretz,,,Haaretz,https://news.google.com/rss/articles/CBMi_wFBVV95cUxPZmRnR1ljc1Bqa0pyaXZKWW84bjRxVFpFWUUwNURuMm9aX2ZtdjFPTWdON3Axb1ZBNDYxdUpjbDFmWEItb3VsZ3J5eEdQanc5RmNHMXFrV1dQSVA4cXZ2MU16Z3ZzcTY2TFNmOUQ4bUlxaENYd1UxNklYWVlLQS1yVlBEVmJCdVNmQU8zbTgtQ0RrclRxb3JnUTZoTlVoLW1CamdpQTZzcWlnelRtamEwUkduVm5EZHBRYVVPVlVUN2RhcENHMXE2NmFQTEpacFZNeHg2anRBQlFqNURqNmRiY0ZhWmZmNDdxRFBUdThLZGZUUHpxV1Z1MkpzV2dhenM?oc=5
2026-07-13T06:39:00.000Z,closure,high,"Is Strait of Hormuz closed? US, Iran give conflicting answers amid escalated tensions","Is Strait of Hormuz closed? US, Iran give conflicting answers amid escalated tensions The News International",,,The News International,https://news.google.com/rss/articles/CBMiwwFBVV95cUxPdk5POTQtMnV2aFVNWU15Qk5WWi1SSkdjdUROVVRMSFY2elVfQnE2WDlFMFhIOGpQRlQ5M01zX3FTU3d5Y3kxdDZwMXQzYnJMcDU5SkRyYTlqZF9mODlYQ1FWdzFpdUFoZHZyOEdYZi01NlJnT3Bta1RMejFIU3JwM0lueHhTMGNiUC1mYjhSdm9kdjB1SXdsU1JWMHFCZWZSLVduLTBTVXpqU1ZEVm1IOVotRXJMUXpfaDVFRTltbDlnRDA?oc=5
2026-07-13T06:48:09.000Z,strike,high,Iran launches attacks on Gulf states amid heaviest U.S. strikes in months,Iran launches attacks on Gulf states amid heaviest U.S. strikes in months The Washington Post,,,The Washington Post,https://news.google.com/rss/articles/CBMirAFBVV95cUxORUNEd2J3SmxCOVdjblNITm5abTREZkJaOXZIRzFNTWFLaTV4aTBsZnB0MXllclhjQzRZb0ppYWZObmIzeXJ5SkNNNU1QalZPRTZEdFo4Qm1tMVFzSi10YXN4aVMxU2gyOXhhTFE5RE9DUVJLT3JPLXV6OVJ0S3FrTm9jX25HUVJFSmNDZXE4eDZGZ3RVemc4enlVUlFncDh4MXZLUUdWVVpVazc2?oc=5
